{
  "schema_version": "2.0.0",
  "part_id": "maw_v1",
  "category": "appendage",
  "template": "appendage1",
  "species_tags": [
    "alien"
  ],
  "roles": [
    "manipulator",
    "detail"
  ],
  "size_class": null,
  "status": "placeholder",
  "style_profile": "flesh_stylized_v1",
  "dimensions_m": [
    0.4,
    0.3,
    0.35
  ],
  "length_m": 0.35,
  "budget": {
    "max_triangles": 1500,
    "max_material_slots": 2,
    "texture_size": 1024
  },
  "fallback": {
    "primitive": "sphere",
    "albedo": "#9c5f6a"
  },
  "provenance": {
    "source": "placeholder"
  }
}